,topic_num,topic_perc_contrib,keywords,text
0,0,0.9323,"story, last, also, character, gameplay, feel, instead, present, hype, find","[h1]A Mixed Bag of Survival, Stealth, and Story – A 2024 Perspective on The Last of Us Part 1[/h1]

These are my thoughts but I did use ChatGPT to format and enhance them.

In reflecting on its esteemed launch, ""The Last of Us Part 1"" initially presents itself as a seminal entry into the survival-horror genre. However, revisiting the game in March 2024, I find myself grappling with a mixture of admiration and disappointment.

[h2]The Highlights: Story and Environment[/h2]

At its core, ""The Last of Us"" shines through its narrative and the beautifully desolate world it paints. The game masterfully crafts a post-apocalyptic environment teeming with detail and atmosphere, serving as the backdrop to a story that remains compelling despite its age. The concept of survival is not only a theme but a mechanic, though it's here my enthusiasm wanes.

[h2]Diving Deeper:[/h2]

[h3]Gameplay Dynamics:[/h3]

The crux of my critique lies in the gameplay. Spanning approximately 13 hours, the journey felt more like a chore than an adventure. As a player, you're thrust into a world ravaged by the infected and hostile humans, with the options to approach situations with stealth or aggression (""Rambo style""). The stealth mechanic, ostensibly a key gameplay element, proves tedious, often feeling like it sets you up for failure unless an inordinate amount of effort is invested in perfecting it. This repetitiveness quickly wears thin.

The game's upgrade system paradoxically muddles its intended gameplay dynamics. While weapon enhancements are readily accessible, encouraging a more confrontational, action-packed approach, the stark contrast arises with the [b]stealth and character-based upgrades[/b]. These crucial enhancements, pivotal for those preferring a stealthy playstyle, require a hefty resource investment, rendering them nearly out of reach until the game's later stages.

This imbalance not only hampers the feasibility of consistent stealth gameplay but also introduces a dissonance with the game's thematic essence. While cutscenes might glorify the player's prowess, suggesting a narrative of dominance, the gameplay mechanics, particularly the prohibitive cost of [b]stealth and character upgrades[/b], significantly lean towards vulnerability and survival.

Such a discrepancy between the narrative’s portrayal of the character and the actual gameplay experience, accentuated by an upgrade system that disproportionately favors aggression over stealth, [b]dilutes the game's overarching survival theme[/b], presenting a jarring inconsistency that detracts from the cohesion of the experience.

[h3]Narrative Engagement:[/h3]

The story, while good, falls short of greatness. Its linear progression feels outdated in 2024, a time when player choice and narrative branching have become standard in story-driven games. This lack of player agency diminishes the personal connection to the narrative, a stark contrast to games like ""The Witcher 3,"" where choices significantly impact the storyline. Incorporating choice in the PC remake could have refreshed the game for contemporary audiences without detracting from its core narrative.

[h3]Environmental Design:[/h3]

The game's environment remains a high point, meticulously crafted and immersive. It sets a compelling stage for the story, though further commentary risks nitpicking at what is generally an impressive aspect of the game.

[h2]Conclusion:[/h2]

In sum, ""The Last of Us Part 1"" stands as a testament to the potential of storytelling and environmental design in video games. However, its gameplay mechanics and lack of player agency, especially when viewed through the lens of 2024, highlight missed opportunities for innovation and refinement in its PC iteration. While it retains its place in the annals of video game history, one can't help but feel that this relic of the past could have been so much more with just a few modern enhancements.

[hr][/hr]
"
1,0,0.9105,"story, last, also, character, gameplay, feel, instead, present, hype, find","The Last of Us Part II: A Melancholic Muddle - 0/10

The realm of narrative-driven video games is replete with tales of grandeur, and ""The Last of Us"" stood as a shining example of such magnificence. Thus, it's with a heavy heart that one must navigate the murky waters of its sequel, ""The Last of Us Part II.""

From the outset, the game's tone feels disjointed. Where the original painted a poignant picture of humanity's struggle and the lengths one might go to protect loved ones, Part II meanders, oscillating between half-realized themes and tonal inconsistencies. The gravity of Ellie's journey, so deeply personal in its intent, is often lost amidst the cacophony of secondary narratives that add little to the overarching tale.

Visually, while the world of ""The Last of Us Part II"" boasts intricate details, there's a palpable absence of soul. Environments, though technically marvelous, lack the atmospheric tension that once made every corner turned a potential threat. This sterility permeates even the character models, rendering emotional sequences somewhat hollow.

The game's narrative decisions remain its most contentious aspect. Characters, once beloved, are offered up on the altar of shock value, their arcs concluding in ways that feel unearned and, at times, gratuitous. This penchant for subversion, rather than adding layers, often detracts from the emotional heft of the storyline.

Gameplay, a potential saving grace, also falters. Combat scenarios, though more varied, often descend into repetition, lacking the strategic depth of the original. Stealth, a staple of the series, feels more forced than ever, with AI patterns that seem predictable rather than intuitive.

In sum, ""The Last of Us Part II"" stands as a shadow of its predecessor. Despite its technical prowess and moments of genuine emotional depth, the game feels like a disjointed tapestry of missed opportunities. One can't help but yearn for the nuanced storytelling and immersive world-building of the original."
2,0,0.9062,"story, last, also, character, gameplay, feel, instead, present, hype, find","Review

Rating: ★☆☆☆☆

The Last of Us Part 2 is a prime example **** that prioritizes pushing a supposed ""LGBT agenda"" over delivering a compelling and enjoyable experience. This sequel is marred by heavy-handed and forced attempts at inclusivity, overshadowing any potential for a well-crafted story and engaging gameplay.

Rather than focusing on the characters and their development, the game seems more interested in hammering its progressive messaging into the player's consciousness. The inclusion of LGBTQ+ characters feels contrived and unnecessary, as their sexual orientation becomes their defining trait rather than an aspect of their identity. The narrative sacrifices depth and coherence to virtue signal, resulting in a disjointed and unsatisfying storyline.

Unfortunately, this obsession with inclusivity negatively impacts the gameplay as well. The forced diversity feels more like tokenism, with the game's agenda taking precedence over meaningful gameplay mechanics. It's clear that the developers prioritized their message over creating a polished and enjoyable gaming experience.

In addition to the narrative shortcomings, the gameplay itself is riddled with flaws. The combat encounters lack innovation and fail to offer any real challenge, while the stealth mechanics feel clunky and unrefined. The pacing is uneven, with stretches of repetitive gameplay that make the experience monotonous and tedious.

Furthermore, technical issues plague the game, with frequent frame rate drops and glitches that disrupt immersion and undermine the overall experience. It's disheartening to see a game of this magnitude released with such significant technical shortcomings.

Ultimately, The Last of Us Part 2's preoccupation with pushing an ""LGBT agenda"" at the expense of a well-crafted narrative and enjoyable gameplay is a disservice to the potential of the franchise. Instead of embracing diversity in a meaningful way, the game comes across as pandering and lacks the substance that made its predecessor so memorable. It's a missed opportunity and a disappointing addition to the series ."
3,0,0.856,"story, last, also, character, gameplay, feel, instead, present, hype, find","A Disappointing and Overrated Experience

The Last of Us Part 1, often hailed as a masterpiece by critics and fans alike, left me profoundly disappointed and questioning the overwhelming praise it has received. While it undoubtedly has its strengths, I found several aspects of the game that left me frustrated and underwhelmed.

First and foremost, the gameplay in The Last of Us Part 1 falls short of its potential. The combat mechanics are clunky, making it a chore to engage in gunfights or melee encounters. The scarcity of ammunition and resources often leads to unnecessary frustration, as the game forces players into situations where they must resort to trial-and-error tactics rather than strategic gameplay.

The AI of both enemy and companion characters is often erratic and inconsistent. Enemies display unrealistic levels of awareness at times, making stealth an unreliable option. Conversely, your AI companions can frequently be a hindrance rather than an asset, failing to react intelligently to the danger around them and compromising your efforts to progress.

While the story of The Last of Us Part 1 is praised for its emotional depth and character development, I found it to be predictable and clichéd. The post-apocalyptic setting, overrun by a zombie-like infection, feels tired and unoriginal, lacking the fresh perspective that could have set it apart from similar narratives in the genre. Furthermore, the character of Joel, often touted as a complex anti-hero, comes across as one-dimensional and unsympathetic for much of the game.

The pacing is another significant issue. The game's narrative is often disrupted by extended sections of mundane and repetitive gameplay, such as moving ladders or planks to progress. These segments only serve to pad out the game's length without adding meaningful content or excitement.


In summary, The Last of Us Part 1 is a game that I found to be overhyped and ultimately underwhelming. Its gameplay frustrations, inconsistent AI, unoriginal storytelling. While it may have resonated with many players, I couldn't help but feel let down by the immense acclaim surrounding this title."
4,0,0.8366,"story, last, also, character, gameplay, feel, instead, present, hype, find","lol this is supposed to the best ps4 game? boring gameplay, boring story, boring fights, no crafting in zombie game, no resource collecting, how they failed the easiest idea in a history of video games"
5,0,0.8335,"story, last, also, character, gameplay, feel, instead, present, hype, find","its alright if you like sneaking, moving ladders, sneaking, diving under water, moving pallets, moving dumpsters, sneaking, shooting the occasional guy and then moving a ladder to sneak under water to move a pallet to the dumpster. The TV show is the best way to digest this story without the repetitive and monotonous gameplay."
6,0,0.8203,"story, last, also, character, gameplay, feel, instead, present, hype, find","Title: A Disastrous Sequel That Ruins the Legacy - The Last of Us Part IIRating: ★☆☆☆☆Where do I even begin with The Last of Us Part II? It's a colossal disappointment that fails to live up to the high standards set by its predecessor. This sequel is a perfect example of how not to continue a beloved franchise.First and foremost, the story is an absolute trainwreck. It's convoluted, poorly paced, and filled with unnecessary twists and turns that only serve to confuse and frustrate players. The narrative decisions made by the developers seem like they were chosen purely for shock value rather than for the sake of meaningful storytelling. The characters we grew to love in the first game are mishandled and their arcs are completely undermined, leaving players feeling detached and uninvested.Speaking of characters, the new additions to the cast are equally disappointing. Ellie, the strong and relatable protagonist from the original game, is reduced to a one-dimensional revenge-driven character with questionable decision-making skills. The game tries to force players into empathizing with her, but it's hard to sympathize when her actions become increasingly irrational and out of **** gameplay, while solid in the first game, feels clunky and uninspired here. The stealth mechanics are frustratingly inconsistent, often leading to cheap deaths and repetitive encounters. The level design lacks creativity and fails to offer any real sense of exploration. It's a far cry from the immersive and engaging gameplay experience we had in the first **** aspect that cannot be ignored is the game's heavy-handed political agenda. The Last of Us Part II seems more interested in pushing a specific message than in delivering an enjoyable gaming experience. The themes of revenge, violence, and LGBTQ+ representation are forced upon the players, overshadowing any potential for genuine emotional **** top of all these flaws, the technical issues are abundant. The game suffers from frequent frame rate drops, long loading times, and numerous glitches that break immersion and hinder gameplay. It's astonishing that a game of this magnitude could be released with such glaring technical **** conclusion, The Last of Us Part II is a soulless cash grab that tarnishes the legacy of its predecessor. It fails to capture the essence of what made the original game so special and instead delivers a mess of a story, uninspired gameplay, and technical problems. Fans of the first game will be left feeling betrayed, and newcomers will be left wondering what all the hype was about. Save your time and money—this sequel is a disgrace."
7,0,0.8183,"story, last, also, character, gameplay, feel, instead, present, hype, find","My Dear Albert,

I do hope this epistle finds you in good health and high spirits. It is with great pleasure that I impart a recent discovery that hath occupied much of my leisure. A game titled ""The Last of Us"" hath been procured on Steam.

I confess, this game is unlike any I have beheld before. It is situated in a world devastated by a fungal infestation, and the remnant survivors must fight for their very existence against infected humans and other perilous adversaries.

The game possesses an incredible sense of realism, with breathtaking graphics and sounds that ring true. I find myself completely absorbed in this wondrous world, and oftentimes I lose track of time whilst indulging.

Verily, some may view such indulgences as trivial, but I implore thee to remember that leisure and respite are essential, even amidst the flurry of our daily lives. Additionally, I have found that games, like ""The Last of Us,"" doth enhance my faculties, improving my analytical skills and logical reasoning.

I pray this missive finds thee in good stead, and I earnestly hope that thou art likewise enjoying thyself during these distressing times. Do write back and inform me of thy welfare and wellbeing.

With all my affection and esteem,
Benjamin Franklin"
8,0,0.8008,"story, last, also, character, gameplay, feel, instead, present, hype, find","The Last of Us Part 1 is a game that tries to be a movie, but fails at both. It is a boring, linear, and predictable story that forces you to play as a grumpy old man who has to escort a bratty teenage girl across a zombie-infested America. The gameplay is repetitive, the stealth is frustrating, and the combat is clunky. The graphics are decent, but the animations are stiff and the facial expressions are unnatural. The voice acting is overrated, the dialogue is cheesy, and the characters are unlikable. The game is full of clichés, plot holes, and moral dilemmas that are neither original nor meaningful. The game is not fun, it is not immersive, it is not emotional, it is not art. It is a waste of time and money. The Last of Us Part 1 is the last game you should ever play."
9,0,0.8,"story, last, also, character, gameplay, feel, instead, present, hype, find","Abby: A boring and uncharismatic characterAbby is the game's main antagonist. She is a former member of the Fireflies, an organization seeking a cure for the brain infection that caused the apocalypse. Abby is a strong and skilled woman, but she is also a violent and cruel **** game spends half the time with Abby, which is a problem for many players. Abby is a boring and uncharismatic character. She's not interesting or relatable, and her revenge story is simplistic and predictable.A forced storyThe game tries to force players to empathize with Abby. The game shows Abby's story in a way that makes it more relatable, but that's not enough to make players like her.Abyss is a horrible character. She kills Joel, a character loved by the public, in a brutal and unnecessary way. It's hard for players to forget this, even if Abby had her own reasons for doing what she did.ConclusionThe Last of Us Part II is a technically impressive game, but its story is disappointing. The story tries to force players to empathize with an undesirable character, and it doesn't **** game is a good example of how a poorly executed story can ruin a gaming experience. If you're looking for a gripping, gripping story, The Last of Us Part II isn't the game for you."
10,1,0.8581,"run, setting, pc, fps, performance, port, even, low, still, well",Game runs way to poorly im on ultra performance and ultra low settings and everything looks like a PS2 game and I can barley crack 20 fps the optimization is a joke
11,1,0.8423,"run, setting, pc, fps, performance, port, even, low, still, well","Game is fantastic 10/10, but port is still pure shit.

I've got PC that's 5-10% (Ryzen 5 5600, RX 6650 XT) better than the reccomended one, but the only way for me to play game in 60+ fps, was to set everything on medium and turn FSR 2 on. Otherwise on High it was around 50fps and in intensive areas it even dropped to 25-30."
12,1,0.84,"run, setting, pc, fps, performance, port, even, low, still, well",the worse optimization ever. i play this on gtx 1050 4 vram i7 8750h and 16 gb ram and i cant even get 60 fps on 720 p with performance fsr
13,1,0.837,"run, setting, pc, fps, performance, port, even, low, still, well","I can run cyberpunk on high settings, but even on lowest graphics setting, this game cannot maintain 30 fps"
14,1,0.8358,"run, setting, pc, fps, performance, port, even, low, still, well",This game is terrible. You need a 12 core CPU and minimum 12GB of VRAM to have a stable experience. Even then its very stuttery and frame rates go from 80-140. Terrible
15,1,0.8341,"run, setting, pc, fps, performance, port, even, low, still, well","Amazing game, incredibly poorly optimized. Playing at sub-60 FPS on minimum settings with a 1080 TI, even though the PS3 pales in comparison to my computer."
16,1,0.8199,"run, setting, pc, fps, performance, port, even, low, still, well",Why does my game only run at 30 fps when having medium graphics. Ultra mode also put my vram to almost 200% fix your game please.
17,1,0.8083,"run, setting, pc, fps, performance, port, even, low, still, well","Unreasonably high hardware requirements. 

Recommended requirements on store page are false."
18,1,0.807,"run, setting, pc, fps, performance, port, even, low, still, well","Okay look. I love the last of us and was so excited to play the defnative edition of this game on pc but this game is not it. It runs poorly at best on my hardware, just for context I have a GTX 1660 Ti and a Intel COre i7-10750H cpu and I get massive frame drops at a locked 60 low settings. If I drop the frame rate cap to 30 it's stable but this is awful. I have a 1440p monitor and by dropping the resolution to 1080 I was able to get much better frame rates and run the game at high settings. This is bullshit, I should be able to run this game at my monitors native resolution and get decent framerates, I would not recommend this for most people."
19,1,0.804,"run, setting, pc, fps, performance, port, even, low, still, well","Terrible , just terrible optimisation , i set everythin on low - nothing change , game is under 40 fps with many heavy freezes. 
How is that possible ?
Im playing RDR2 at ultra settings with 50-60 fps 
My parameters are i7-10750H to 5.0 GHz , 16 ram and geforce rtx 3060"
20,2,0.8281,"shader, wait, take, hour, time, update, load, patch, minute, still",spent more time installing shaders than playing the game. Every time theres a patch it takes an hour for shaders. Still the patches havent helped with optimization either. Steam refused refund too. A mess
21,2,0.8227,"shader, wait, take, hour, time, update, load, patch, minute, still","Five times I had to build shaders. Game took me ~13 hours to complete, the rest of playtime is just building shaders.
New update > build shaders, New driver -> build shaders, random game crash -> game data corrupted -> repair files -> build shaders, I farted -> build shaders."
22,2,0.8212,"shader, wait, take, hour, time, update, load, patch, minute, still","The Neverending 'Building shaders' game
I cannot recommend it, in it's current state.
50minutes for shader compile? , it's a remaster of the remasterd ps game, i bet they didnt wait for 50mins.
Edit:
Completed the game, its decent. Took 23hrs, but more than half that was loading and building shaders. 
"
23,2,0.8128,"shader, wait, take, hour, time, update, load, patch, minute, still","these 5 hours arent even from playing they are from waiting the shaders


*edit: now my playtime is 12h and i've finally downloaded the shaders"
24,2,0.8033,"shader, wait, take, hour, time, update, load, patch, minute, still","Crashed after 88 minutes of 20% shader building. When you're eventually done building shaders, you sureley cannot refund anymore.

PS: After successfully building shaders, startup is like 9 minutes and you got several minutes of loading every 2-3 minutes of playtime."
25,2,0.8023,"shader, wait, take, hour, time, update, load, patch, minute, still","20 Hours of trying to game to run and still no luck, Can only get to the title screen but crashes when trying to start a game. I have 0 minutes of gameplay and cannot refund game because its over the 2 hours play limit. Such crap, it takes 3 hours just to load the shaders."
26,2,0.7961,"shader, wait, take, hour, time, update, load, patch, minute, still","Game was working fine for 3 days and now all of a sudden  wouldn't even launch. Tried like 10 times already, not even going past the loading screen."
27,2,0.783,"shader, wait, take, hour, time, update, load, patch, minute, still",I spend more time building shaders than playing the game every time I have to update my drivers or the game.
28,2,0.7783,"shader, wait, take, hour, time, update, load, patch, minute, still",I had to compile shaders on the first launch. Fine. But it's making me compile shaders again the second time. Not fine.
29,2,0.7631,"shader, wait, take, hour, time, update, load, patch, minute, still","took around 24 hours to download, and once it finally did, the game did not even start."
30,3,0.882,"release, really, review, go, say, year, see, know, come, make","Im quite sure i did review this game when it came out, so it prop. got deleted. To make it short: If you loved the first Part you will hate it. No matter what the 93 Critic Score says. The charakter are not the same as in the first one."
31,3,0.8186,"release, really, review, go, say, year, see, know, come, make",This game is way too wonky the subtitles are turning into symbols and the color changes to a disco prism colors. This game release was the worse I’ve ever seen. I normally dont complain but I love the last of us series from ps. I want money back bc this is crap
32,3,0.8077,"release, really, review, go, say, year, see, know, come, make",I genuinely feel ripped off. I have waited for so long now and STILL this game is a horrendous release that should have never been made if this was how they planned to treat it. They have given up and admitted they will never get KBM configuration right and just outright tell you to use a controller now too.
33,3,0.7817,"release, really, review, go, say, year, see, know, come, make",Moviegame but the movie is bad. Watch the cut scenes on YouTube if you want to experience this critically acclaimed goty.
34,3,0.7769,"release, really, review, go, say, year, see, know, come, make",After a 10/10 masterpiece of the first one they really messed this game up and ruined the future for the franchise
35,3,0.7481,"release, really, review, go, say, year, see, know, come, make","I played this game on release and reviewed it but it got deleted because everyone review bombed it. I feel so passionately about how badly they messed up the game that I came back years later to say how truly awful this game was. Not only was it an utter disgrace to the original game, but it manages to have the worst storyline of any game I've played in recent years. I'm sorry if you played this trash."
36,3,0.7247,"release, really, review, go, say, year, see, know, come, make","Have you always wanted to see Sarah die in 4K over and over again?

Well now you can! Because of the amount of crashes you can relieve your favorite moments from the game that shocked the world on Playstation 3.

This is by far the worst port in the history of ports and they could have used ANY other porter, but Cuckmann seems to care about ANYTHING ELSE except fans of what was long considered his masterpiece.

I'm not gonna refund but it will probably get fixed eventually and I hope my now 2 year old daughter will be the one to see it."
